{
  "automated_pass_count": 30,
  "claim_boundary": "Automated PASS proves that the prepared comparison matches the hash-verified source and adapter. It is not human review; reviewer decisions remain null until a named reviewer signs each row.",
  "completed_record_count": 0,
  "dataset_version": "Data Series 801, 2013 release",
  "prepared_record_count": 30,
  "records": [
    {
      "adapter_observations": [
        {
          "analyte": "As",
          "latitude": "31.3146",
          "longitude": "-87.1166",
          "medium": "soil",
          "raw_value": "2.1",
          "record_id": "rec-3c16ad2e1590d783c6112c2c8138490dedd2a64edc36c03ed3276018b7544aa7",
          "sample_depth_max_m": "0.05",
          "sample_depth_min_m": "0",
          "sample_id": "C-328818",
          "soil_layer": "top-0-5cm",
          "unit": "mg/kg"
        },
        {
          "analyte": "Cu",
          "latitude": "31.3146",
          "longitude": "-87.1166",
          "medium": "soil",
          "raw_value": "5.9",
          "record_id": "rec-892f9d1e4470378959e8ad3228da1874b261c1405640749aa8037bec197118f4",
          "sample_depth_max_m": "0.05",
          "sample_depth_min_m": "0",
          "sample_id": "C-328818",
          "soil_layer": "top-0-5cm",
          "unit": "mg/kg"
        },
        {
          "analyte": "Ni",
          "latitude": "31.3146",
          "longitude": "-87.1166",
          "medium": "soil",
          "raw_value": "3.3",
          "record_id": "rec-abbc5192b0fb215735fa4a72008cb6e4cbcea485c663a7905f843c48a0409fe1",
          "sample_depth_max_m": "0.05",
          "sample_depth_min_m": "0",
          "sample_id": "C-328818",
          "soil_layer": "top-0-5cm",
          "unit": "mg/kg"
        },
        {
          "analyte": "Zn",
          "latitude": "31.3146",
          "longitude": "-87.1166",
          "medium": "soil",
          "raw_value": "15",
          "record_id": "rec-fb7c45816fd1f19d0afd6142c6a9f67e59af19210f4077f0274c603b66224369",
          "sample_depth_max_m": "0.05",
          "sample_depth_min_m": "0",
          "sample_id": "C-328818",
          "soil_layer": "top-0-5cm",
          "unit": "mg/kg"
        }
      ],
      "automated_checks": {
        "coordinates_preserved": true,
        "depth_semantics_preserved": true,
        "four_target_values_preserved": true,
        "registered_file_hash_matches": true,
        "sample_id_preserved": true,
        "soil_layer_preserved": true,
        "source_units_preserved": true,
        "stable_observation_ids_unique": true
      },
      "automated_status": "PASS",
      "published_target_raw_values": {
        "As": "2.1",
        "Cu": "5.9",
        "Ni": "3.3",
        "Zn": "15"
      },
      "review_id": "usgs-conus-soil-review-01",
      "reviewer": {
        "decision": null,
        "notes": null,
        "reviewed_at": null,
        "reviewer": null
      },
      "sample_id": "C-328818",
      "selection_reasons": [
        "soil_layer=top-0-5cm",
        "spatially_even_source_order"
      ],
      "source_locator": "Appendix_2b_Top5_18Sept2013.txt#row=15",
      "source_record_id": "src-bfcdf81a22ca8e9c3e880dc3a65855080f30db67b8c2778810d405524fdb2f91"
    },
    {
      "adapter_observations": [
        {
          "analyte": "As",
          "latitude": "33.578",
          "longitude": "-115.053",
          "medium": "soil",
          "raw_value": "2.6",
          "record_id": "rec-ae4c501c541e95cad301ae31a9a09eb5552595c3b80769718539eb6695780d1b",
          "sample_depth_max_m": "0.05",
          "sample_depth_min_m": "0",
          "sample_id": "C-343186",
          "soil_layer": "top-0-5cm",
          "unit": "mg/kg"
        },
        {
          "analyte": "Cu",
          "latitude": "33.578",
          "longitude": "-115.053",
          "medium": "soil",
          "raw_value": "11.4",
          "record_id": "rec-4ae26d7f79fb5fd852404f5266c96d2a6a5008201dfe0e89778a723b2402f7cb",
          "sample_depth_max_m": "0.05",
          "sample_depth_min_m": "0",
          "sample_id": "C-343186",
          "soil_layer": "top-0-5cm",
          "unit": "mg/kg"
        },
        {
          "analyte": "Ni",
          "latitude": "33.578",
          "longitude": "-115.053",
          "medium": "soil",
          "raw_value": "8.7",
          "record_id": "rec-05fd82e5ab9121e85194aa79a41e4b425f1826640418cf9306d6b2068ff1b18f",
          "sample_depth_max_m": "0.05",
          "sample_depth_min_m": "0",
          "sample_id": "C-343186",
          "soil_layer": "top-0-5cm",
          "unit": "mg/kg"
        },
        {
          "analyte": "Zn",
          "latitude": "33.578",
          "longitude": "-115.053",
          "medium": "soil",
          "raw_value": "38",
          "record_id": "rec-36aacc3813152dbfeda3f7305eaead40167a6d84c328d471d655cb390a0058a6",
          "sample_depth_max_m": "0.05",
          "sample_depth_min_m": "0",
          "sample_id": "C-343186",
          "soil_layer": "top-0-5cm",
          "unit": "mg/kg"
        }
      ],
      "automated_checks": {
        "coordinates_preserved": true,
        "depth_semantics_preserved": true,
        "four_target_values_preserved": true,
        "registered_file_hash_matches": true,
        "sample_id_preserved": true,
        "soil_layer_preserved": true,
        "source_units_preserved": true,
        "stable_observation_ids_unique": true
      },
      "automated_status": "PASS",
      "published_target_raw_values": {
        "As": "2.6",
        "Cu": "11.4",
        "Ni": "8.7",
        "Zn": "38"
      },
      "review_id": "usgs-conus-soil-review-02",
      "reviewer": {
        "decision": null,
        "notes": null,
        "reviewed_at": null,
        "reviewer": null
      },
      "sample_id": "C-343186",
      "selection_reasons": [
        "soil_layer=top-0-5cm",
        "spatially_even_source_order"
      ],
      "source_locator": "Appendix_2b_Top5_18Sept2013.txt#row=555",
      "source_record_id": "src-ff8814a810cfd935ac8da0522d985896058a12659fd393fb3ac3ba2f6f49a107"
    },
    {
      "adapter_observations": [
        {
          "analyte": "As",
          "latitude": "45.8807",
          "longitude": "-116.0204",
          "medium": "soil",
          "raw_value": "3.1",
          "record_id": "rec-ea69eef96e9cc203defc00922e6a25efa7f828569a9f9d4b923f5343b23740c2",
          "sample_depth_max_m": "0.05",
          "sample_depth_min_m": "0",
          "sample_id": "C-334666",
          "soil_layer": "top-0-5cm",
          "unit": "mg/kg"
        },
        {
          "analyte": "Cu",
          "latitude": "45.8807",
          "longitude": "-116.0204",
          "medium": "soil",
          "raw_value": "36.8",
          "record_id": "rec-93e4246ce87115bf2645014d0a25f2c4e4d83c2319791aa2e939c3f3741b15d3",
          "sample_depth_max_m": "0.05",
          "sample_depth_min_m": "0",
          "sample_id": "C-334666",
          "soil_layer": "top-0-5cm",
          "unit": "mg/kg"
        },
        {
          "analyte": "Ni",
          "latitude": "45.8807",
          "longitude": "-116.0204",
          "medium": "soil",
          "raw_value": "104",
          "record_id": "rec-eff87d980d2fceeeb862c56839d790ca32545efdce6c756fc8d4734481423f3f",
          "sample_depth_max_m": "0.05",
          "sample_depth_min_m": "0",
          "sample_id": "C-334666",
          "soil_layer": "top-0-5cm",
          "unit": "mg/kg"
        },
        {
          "analyte": "Zn",
          "latitude": "45.8807",
          "longitude": "-116.0204",
          "medium": "soil",
          "raw_value": "83",
          "record_id": "rec-079f59e9ab153fd71fe66d89b4bcde05189d02ec0bfda218b95d48628207b457",
          "sample_depth_max_m": "0.05",
          "sample_depth_min_m": "0",
          "sample_id": "C-334666",
          "soil_layer": "top-0-5cm",
          "unit": "mg/kg"
        }
      ],
      "automated_checks": {
        "coordinates_preserved": true,
        "depth_semantics_preserved": true,
        "four_target_values_preserved": true,
        "registered_file_hash_matches": true,
        "sample_id_preserved": true,
        "soil_layer_preserved": true,
        "source_units_preserved": true,
        "stable_observation_ids_unique": true
      },
      "automated_status": "PASS",
      "published_target_raw_values": {
        "As": "3.1",
        "Cu": "36.8",
        "Ni": "104",
        "Zn": "83"
      },
      "review_id": "usgs-conus-soil-review-03",
      "reviewer": {
        "decision": null,
        "notes": null,
        "reviewed_at": null,
        "reviewer": null
      },
      "sample_id": "C-334666",
      "selection_reasons": [
        "soil_layer=top-0-5cm",
        "spatially_even_source_order"
      ],
      "source_locator": "Appendix_2b_Top5_18Sept2013.txt#row=1094",
      "source_record_id": "src-aaba44c2761bc9419400b862834d4546f336f66c3f192ce4d89747df6b0e78ac"
    },
    {
      "adapter_observations": [
        {
          "analyte": "As",
          "latitude": "38.536",
          "longitude": "-75.9298",
          "medium": "soil",
          "raw_value": "2.2",
          "record_id": "rec-0f14accfd99cf95b51622885614a2802f3d049add8928b1c6a61d28f2fdc9ba5",
          "sample_depth_max_m": "0.05",
          "sample_depth_min_m": "0",
          "sample_id": "C-320867",
          "soil_layer": "top-0-5cm",
          "unit": "mg/kg"
        },
        {
          "analyte": "Cu",
          "latitude": "38.536",
          "longitude": "-75.9298",
          "medium": "soil",
          "raw_value": "11",
          "record_id": "rec-f0c0b4a2d8364c398d3b565e92b30ba9edaa8076c4e064b943f13a7283b3dd52",
          "sample_depth_max_m": "0.05",
          "sample_depth_min_m": "0",
          "sample_id": "C-320867",
          "soil_layer": "top-0-5cm",
          "unit": "mg/kg"
        },
        {
          "analyte": "Ni",
          "latitude": "38.536",
          "longitude": "-75.9298",
          "medium": "soil",